Name,Location,Price,Notes / Source
Renaissance Lucknow Hotel,"Gomti Nagar, Lucknow",300000,"4–5 star venue, large capacity"
Hotel Clarks Avadh,Lucknow,250000,Premium wedding hotel
Novotel Lucknow,Lucknow,200000,Mid-luxury hotel venue
The Grand JBR,"Viraj Khand, Gomti Nagar, Lucknow",150000,Affordable luxury option
Hotel The Leaf Banquet & Lawn,"Gomti Nagar Extension, Lucknow",120000,Lawn + hall venue
Hotel Amanda,Lucknow,80000,Budget venue
ANR Hotel,"Gurudwara Road, Lucknow",60000,Entry-level banquet in hotel
Golden Tulip Lucknow,"Station Road, Udaiganj, Lucknow",100000,Budget-friendly mid-range hotel
Hotel Tekarees Inn,"Ashok Marg, Lucknow",50000,Smaller capacity hotel banquet
"The Regnant, Nirala Nagar","A-35 Nirala Nagar, Lucknow",150000,Venue with 25–850 guest capacity
